#schema: gunit book list v1 — columns are PIPE-separated (|)
#  1 title    2 author    3 status    4 md5/source    5 date    6 calibre_id|se-empty
#  status: (blank)=pending  downloaded  nomatch  failed  pdf-only  quota_blocked  tagged  queued/downloading/completed (legacy)
#  col4: Anna's md5, or se:<author>/<title> for Standard Ebooks rows
#  col6: calibre book id on DONE rows; the literal "se-empty" on quota_blocked/nomatch/pdf-only rows means SE was already searched and had nothing (skip re-search)
#  lines beginning with # are comments; "#tag: NAME[, NAME...]" sets the calibre tags for this whole list
#columns: Title | Author
#tag: BookTok



A Court of Mist and Fury (A Court of Thorns and Roses, #2)|Sarah J. Maas|downloaded|0302c28ddbaf2610ebe7ffa9c74a62d8|2026-06-18T21:16|2151
The Cruel Prince (The Folk of the Air, #1)|Holly Black|downloaded|027cc61e4c0b9d1f7e4506f811a07858|2026-06-18T21:17|2152
Six of Crows (Six of Crows, #1)|Leigh Bardugo|downloaded|1a6797bb476f4abc127b32f3ca83fd4e|2026-06-18T21:18|2153
A Court of Thorns and Roses (A Court of Thorns and Roses, #1)|Sarah J. Maas|downloaded||2026-06-19T13:11|2160
Bright Burns the Flame (Bright Burns the Flame, #1)|Angelina J. Steffort|nomatch||2026-06-19T13:12|se-empty
Fourth Wing (The Empyrean, #1)|Rebecca Yarros|downloaded|10811aaf897391fb70c40549fec7608c|2026-06-19T13:13
Shatter Me (Shatter Me, #1)|Tahereh Mafi|downloaded|146a6b4fdf673fc26d62d6b5453d3bc4|2026-06-19T13:14|2173
The Lightning Thief (Percy Jackson and the Olympians, #1)|Rick Riordan|downloaded||2026-06-19T13:14|1689
A Court of Wings and Ruin (A Court of Thorns and Roses, #3)|Sarah J. Maas|downloaded|189593313a3d167414f3b338512037be|2026-06-19T13:16|2174
The Song of Achilles|Madeline Miller|downloaded|13af0116ccfe8003f57d1341c7b71219|2026-06-19T13:17
The Inheritance Games (The Inheritance Games, #1)|Jennifer Lynn Barnes|quota_blocked|00441e32ccb03929198805888a134d2e|2026-06-19T13:18|se-empty
A Good Girl's Guide to Murder (A Good Girl's Guide to Murder, #1)|Holly Jackson|quota_blocked||2026-06-19T13:18|se-empty
The Seven Husbands of Evelyn Hugo | Taylor Jenkins Reid
Caraval (Caraval, #1)|Stephanie Garber|downloaded|0228372c2da977eb942181cebc882780|2026-06-19T19:36
From Blood and Ash (Blood and Ash, #1)|Jennifer L. Armentrout|downloaded|10f511508890ba2c9e50de5827865369|2026-06-18T21:20
The Wicked King (The Folk of the Air, #2) | Holly Black
House of Earth and Blood (Crescent City, #1)|Sarah J. Maas|downloaded|04bebfb0e2fff14357c1b4e55c1f3ddf|2026-06-19T19:37
The Queen of Nothing (The Folk of the Air, #3) | Holly Black
Powerless (The Powerless Trilogy, #1) | Lauren Roberts
Shadow and Bone (Shadow and Bone, #1)|Leigh Bardugo|downloaded|04bdacf1a9c8bffb84e4173d3b59b59c|2026-06-18T21:22|2155
It Ends with Us (It Ends with Us, #1)|Colleen Hoover|downloaded|2cd908079c6a8805457a4f367b1dc159|2026-06-18T21:27|2156
The Selection (The Selection, #1)|Kiera Cass|downloaded|05b530d831170ee6c6e20be389a7ad1d|2026-06-18T21:29|2157
Throne of Glass (Throne of Glass, #1)|Sarah J. Maas|downloaded|1ebb1b0d4501c7ea05404ecab3b56d12|2026-06-18T21:30
Divergent (Divergent, #1)|Veronica Roth|downloaded||2026-06-18T21:30|1716
A Court of Silver Flames (A Court of Thorns and Roses, #5)|Sarah J. Maas|downloaded|657c39f34fc3730cb1b6dc51b0e10d15|2026-06-18T21:31|2159
A Court of Frost and Starlight (A Court of Thorns and Roses, #4)|Sarah J. Maas|downloaded|0ec91949f0486783a8e1ab3ee664763c|2026-06-18T21:32|2160
Red Queen (Red Queen, #1)|Victoria Aveyard|downloaded|05718e9771f6c84aa35eea2bcf749987|2026-06-18T21:33|2161
Better Than the Movies (Better Than the Movies, #1)|Lynn Painter|downloaded|59ab0f824d446864222eaea918f9853e|2026-06-19T22:37
Circe | Madeline Miller
Terms and Conditions Apply: Social Media Apps: Promises Vs Reality | R. Suleman
Once Upon a Broken Heart (Once Upon a Broken Heart, #1)|Stephanie Garber|downloaded|18577547ef536e59cf7a37ae1ba15d9f|2026-06-19T19:38
Kingdom of Ash (Throne of Glass, #7)|Sarah J. Maas|downloaded|06c5e637f2e1498b7063795f5710b688|2026-06-19T19:39
The Book Thief|Markus Zusak|downloaded||2026-06-19T19:39|366
The Invisible Life of Addie LaRue|V.E. Schwab|downloaded|562601f2ddb74f222d1d509c9bf6257b|2026-06-19T19:40
Punk 57|Penelope Douglas|downloaded||2026-06-18T21:36|2053
The Wrath and the Dawn (The Wrath and the Dawn, #1)|Renée Ahdieh|downloaded|177892f22f5bd6629dda7d49c61a6a58|2026-06-19T19:41
City of Bones (The Mortal Instruments, #1)|Cassandra Clare|downloaded|25b89d7e4b4868c7016ab9e54cc854ac|2026-06-18T21:37
Heartless|Marissa Meyer|downloaded|0a9003f3db8bb9f697369c00e67fa24d|2026-06-19T19:42
Crown of Midnight (Throne of Glass, #2)|Sarah J. Maas|downloaded|186e04b5c291529191ccc000920113ba|2026-06-19T19:43
A Kingdom of Flesh and Fire (Blood and Ash, #2)|Jennifer L. Armentrout|downloaded|06a332c2ce8511c4d05f9b7534350f5b|2026-06-18T21:38|2163
Verity|Colleen Hoover|downloaded|1e89fd1ff5c86976a876e60f906ef803|2026-06-19T19:44
Divine Rivals (Letters of Enchantment, #1)|Rebecca Ross|downloaded|0f4d572fc47738bd17d512d45ac96b6f|2026-06-18T21:39
The Prison Healer (The Prison Healer, #1)|Lynette Noni|downloaded|15b295d6907a4889be8fcefce8c5c8f6|2026-06-19T19:45
A Touch of Darkness (Hades x Persephone, #1)|Scarlett St. Clair|downloaded|2656b242d740b02b0771b478499aa53a|2026-06-19T19:45
Legendborn (Legendborn #1)|Tracy Deonn|downloaded|1b204f9f436dc35db0b7b5f3312eda24|2026-06-18T21:41|2165
The City of Brass (The Daevabad Trilogy, #1)|S.A. Chakraborty|downloaded|1c6f024b1413aa2621fcc7ef7e216a42|2026-06-19T19:46
The Poppy War (The Poppy War, #1)|R.F. Kuang|downloaded|4f0a42d6400ca3a04e5612590ec51553|2026-06-19T19:47
Assistant to the Villain (Assistant to the Villain, #1)|Hannah Nicole Maehrer|downloaded|0f4c95e0092b4825e0d77d175d79a43c|2026-06-19T19:48
To Kill a Kingdom (Hundred Kingdoms, #1) | Alexandra Christo
Serpent & Dove (Serpent & Dove, #1) | Shelby Mahurin
The Night Circus|Erin Morgenstern|downloaded|24c8934269c3fb430d26907459b17ee3|2026-06-18T21:42|2166
Crooked Kingdom (Six of Crows, #2) | Leigh Bardugo
Legend (Legend, #1)|Marie Lu|downloaded|0a921dc5a96891ff8fd8c2d7fce59c55|2026-06-18T21:45|2167
Empire of Storms (Throne of Glass, #5)|Sarah J. Maas|downloaded|0cc9f7fd9ef94902bccc51c7dd77b7c4|2026-06-18T21:46|2168
We Were Liars|E. Lockhart|downloaded|13ba9c24ad82bec35a908ba21614765c|2026-06-18T21:47
Good Girl, Bad Blood (A Good Girl's Guide to Murder, #2) | Holly Jackson
As Good As Dead (A Good Girl's Guide to Murder, #3) | Holly Jackson
Heir of Fire (Throne of Glass, #3) | Sarah J. Maas
We Hunt the Flame (Sands of Arawiya, #1) | Hafsah Faizal
Queen of Shadows (Throne of Glass, #4) | Sarah J. Maas
Tower of Dawn (Throne of Glass, #6)|Sarah J. Maas|downloaded|022e89108d7f1e2e5293ad608edebde3|2026-06-18T21:49
Babel: An Arcane History | R.F. Kuang
Binding 13 (Boys of Tommen, #1) | Chloe Walsh
The Silent Patient|Alex Michaelides|downloaded|086d3ca333de4b52008b913a74bb2e36|2026-06-19T22:38
Belladonna (Belladonna, #1) | Adalyn Grace
The Reappearance of Rachel Price|Holly Jackson|downloaded||2026-06-18T21:50|2067
The Priory of the Orange Tree (The Roots of Chaos, #1)|Samantha Shannon|downloaded|5d857705ee02892c226143c4f6811c78|2026-06-19T19:50
The Stolen Heir (The Stolen Heir Duology, #1)|Holly Black|downloaded|3be9f3186cf46d29997dd875307cc7b1|2026-06-19T22:39
Emily Wilde’s Encyclopaedia of Faeries (Emily Wilde #1) | Heather Fawcett
Cinder (The Lunar Chronicles, #1)|Marissa Meyer|downloaded|03258dc40d19ee8638c8c23754c3c8d8|2026-06-19T19:50
Behind Closed Doors | B.A. Paris
Five Survive | Holly Jackson
The Bridge Kingdom (The Bridge Kingdom, #1) | Danielle L. Jensen
Crier's War (Crier's War, #1) | Nina Varela
Good Omens: The Nice and Accurate Prophecies of Agnes Nutter, Witch | Terry Pratchett
The Starless Sea|Erin Morgenstern|downloaded|18526ff19be84b4d56e867bc74c90aab|2026-06-19T21:34
King of Scars (King of Scars, #1) | Leigh Bardugo
The Iron King (The Iron Fey, #1)|Julie Kagawa|downloaded|16fdeea6a694948c08cce48efd2c32fa|2026-06-19T19:52
House of Salt and Sorrows (Sisters of the Salt, #1)|Erin A. Craig|downloaded|00147a714d6d57d4dadcaaec3164fdb6|2026-06-18T21:53
Furyborn (Empirium, #1) | Claire Legrand
You've Reached Sam (You've Reached Sam, #1)|Dustin Thao|downloaded|3232ab8dfd3591d4d155359b4fa1da62|2026-06-19T20:59
Twisted Lies (Twisted, #4)|Ana Huang|downloaded|06b8243b3cd3cd978192bfba8f9695bc|2026-06-19T21:00
I'm Glad My Mom Died|Jennette McCurdy|downloaded||2026-06-19T19:53|1904
Twisted Love (Twisted, #1) | Ana Huang
The Shadows Between Us (The Stathos Sisters, #1) | Tricia Levenseller
Cinderella Is Dead|Kalynn Bayron|downloaded|00f13973979bef4f601f17dbd643f259|2026-06-19T19:53
Red Rising (Red Rising Saga, #1)|Pierce Brown|downloaded|2058f173310cd18cec41412019f01c15|2026-06-19T19:55
Bone Crier's Moon (Bone Grace, #1) | Kathryn Purdie
Six Crimson Cranes (Six Crimson Cranes, #1)|Elizabeth Lim|downloaded|0e9f6e917c112d9bf07cc2c3d7de2ab9|2026-06-19T21:00
Dance of Thieves (Dance of Thieves, #1) | Mary E. Pearson
The Reckoning (The Unadjusteds #3)|Marisa Noelle|downloaded|4fa9d481d7e21f8ac067e6c221c7adbe|2026-06-19T21:01
악역의 엔딩은 죽음뿐 1 (Villains are Destined to Die, Vol. 1) | Suol
Smile (Smile, #1)|Raina Telgemeier|downloaded|a0bcf16dabe68a4cab9086bf9ee3537f|2026-06-19T19:56
Sisters (Smile, #2)|Raina Telgemeier|downloaded|a0bcf16dabe68a4cab9086bf9ee3537f|2026-06-19T21:02
Today Tonight Tomorrow (Rowan & Neil, #1) | Rachel Lynn Solomon
Who Was William Shakespeare? | Celeste Davidson Mannis
The Silent Sister|Diane Chamberlain|downloaded|0b1e38c13fdd7299fda50727b5f54e6d|2026-06-19T21:03
Check & Mate|Ali Hazelwood|quota_blocked||2026-06-18T21:56|se-empty
The Ballad of Never After (Once Upon a Broken Heart, #2)|Stephanie Garber|downloaded|010273b17461e404debbcccb65dbe0b4|2026-06-19T22:40
The Crown of Gilded Bones (Blood and Ash, #3)|Jennifer L. Armentrout|quota_blocked||2026-06-19T13:26|se-empty
